{
  "revision": "v1",
  "locale": "en-US",
  "fallbackLocale": "en-US",
  "iconFamily": "lucide",
  "icons": {
    "action.close": {
      "glyph": "X",
      "label": "Close"
    },
    "action.collection": {
      "glyph": "Library",
      "label": "Add to collection"
    },
    "action.delete": {
      "glyph": "Trash2",
      "label": "Delete"
    },
    "action.download": {
      "glyph": "Download",
      "label": "Download"
    },
    "action.favorite": {
      "glyph": "Heart",
      "label": "Favorite"
    },
    "action.home": {
      "glyph": "Home",
      "label": "Home"
    },
    "action.mark-read": {
      "glyph": "CheckCheck",
      "label": "Mark as read"
    },
    "action.open": {
      "glyph": "ArrowRight",
      "label": "Open"
    },
    "action.metadata": {
      "glyph": "Pencil",
      "label": "Edit media"
    },
    "action.optimize": {
      "glyph": "Gauge",
      "label": "Optimize media"
    },
    "action.play": {
      "glyph": "Play",
      "label": "Play"
    },
    "action.playlist": {
      "glyph": "ListMusic",
      "label": "Add to playlist"
    },
    "action.queue": {
      "glyph": "ListPlus",
      "label": "Add to queue"
    },
    "action.rating": {
      "glyph": "Star",
      "label": "Rate"
    },
    "action.reaction": {
      "glyph": "ThumbsUp",
      "label": "React"
    },
    "action.refresh": {
      "glyph": "RotateCw",
      "label": "Refresh"
    },
    "action.report": {
      "glyph": "Flag",
      "label": "Report a problem"
    },
    "action.retry": {
      "glyph": "RefreshCw",
      "label": "Try again"
    },
    "action.save": {
      "glyph": "Bookmark",
      "label": "Save"
    },
    "action.search": {
      "glyph": "Search",
      "label": "Search"
    },
    "action.sign-in": {
      "glyph": "LogIn",
      "label": "Sign in"
    },
    "action.try-nearby": {
      "glyph": "Wifi",
      "label": "Try nearby connection"
    },
    "action.watchlist": {
      "glyph": "BookmarkPlus",
      "label": "Watchlist"
    },
    "action.watched": {
      "glyph": "CircleCheck",
      "label": "Watched"
    },
    "status.download": {
      "glyph": "DownloadCloud",
      "label": "Download status"
    },
    "status.empty": {
      "glyph": "Inbox",
      "label": "No items"
    },
    "status.error": {
      "glyph": "CircleX",
      "label": "Error"
    },
    "status.feedback": {
      "glyph": "MessageSquareWarning",
      "label": "Feedback"
    },
    "status.library": {
      "glyph": "LibraryBig",
      "label": "Library"
    },
    "status.library-channel": {
      "glyph": "TvMinimalPlay",
      "label": "Library Channel"
    },
    "status.live-tv": {
      "glyph": "Radio",
      "label": "Live TV"
    },
    "status.loading": {
      "glyph": "LoaderCircle",
      "label": "Loading"
    },
    "status.locked": {
      "glyph": "LockKeyhole",
      "label": "Locked"
    },
    "status.notification": {
      "glyph": "Bell",
      "label": "Notification"
    },
    "status.offline": {
      "glyph": "WifiOff",
      "label": "Offline"
    },
    "status.playback": {
      "glyph": "CirclePlay",
      "label": "Playback"
    },
    "status.profile": {
      "glyph": "CircleUserRound",
      "label": "Profile"
    },
    "status.rate-limited": {
      "glyph": "Timer",
      "label": "Temporarily unavailable"
    },
    "status.server": {
      "glyph": "ServerOff",
      "label": "Server unavailable"
    },
    "status.success": {
      "glyph": "CircleCheck",
      "label": "Success"
    },
    "status.warning": {
      "glyph": "TriangleAlert",
      "label": "Warning"
    },
    "action.chapters": {
      "glyph": "BookOpen",
      "label": "Chapters"
    },
    "action.cancel": {
      "glyph": "X",
      "label": "Cancel"
    },
    "action.collapse": {
      "glyph": "ChevronDown",
      "label": "Collapse"
    },
    "action.exit-fullscreen": {
      "glyph": "Minimize2",
      "label": "Exit fullscreen"
    },
    "action.forward": {
      "glyph": "FastForward",
      "label": "Forward"
    },
    "action.fullscreen": {
      "glyph": "Maximize2",
      "label": "Fullscreen"
    },
    "action.lyrics": {
      "glyph": "Mic2",
      "label": "Lyrics"
    },
    "action.move-down": {
      "glyph": "ArrowDown",
      "label": "Move down"
    },
    "action.move-up": {
      "glyph": "ArrowUp",
      "label": "Move up"
    },
    "action.mute": {
      "glyph": "VolumeX",
      "label": "Mute"
    },
    "action.next": {
      "glyph": "SkipForward",
      "label": "Next"
    },
    "action.pause": {
      "glyph": "Pause",
      "label": "Pause"
    },
    "action.player-queue": {
      "glyph": "ListMusic",
      "label": "Queue"
    },
    "action.prepare-download": {
      "glyph": "DownloadCloud",
      "label": "Prepare download"
    },
    "action.previous": {
      "glyph": "SkipBack",
      "label": "Previous"
    },
    "action.remove-download": {
      "glyph": "Trash2",
      "label": "Remove download"
    },
    "action.remove-queue": {
      "glyph": "Trash2",
      "label": "Remove from queue"
    },
    "action.repeat": {
      "glyph": "Repeat",
      "label": "Repeat"
    },
    "action.repeat-one": {
      "glyph": "Repeat1",
      "label": "Repeat one"
    },
    "action.replay": {
      "glyph": "RotateCcw",
      "label": "Replay"
    },
    "action.rewind": {
      "glyph": "Rewind",
      "label": "Rewind"
    },
    "action.resume": {
      "glyph": "Play",
      "label": "Resume"
    },
    "action.settings": {
      "glyph": "Settings2",
      "label": "Playback settings"
    },
    "action.shuffle": {
      "glyph": "Shuffle",
      "label": "Shuffle"
    },
    "action.subtitles": {
      "glyph": "Captions",
      "label": "Subtitles"
    },
    "action.technical-stats": {
      "glyph": "Activity",
      "label": "Technical stats"
    },
    "action.unmute": {
      "glyph": "Volume2",
      "label": "Unmute"
    },
    "action.volume": {
      "glyph": "Volume2",
      "label": "Volume"
    },
    "status.audiobook": {
      "glyph": "BookOpen",
      "label": "Audiobook"
    },
    "status.music": {
      "glyph": "Music2",
      "label": "Music"
    },
    "status.preparation": {
      "glyph": "WandSparkles",
      "label": "Version preparation"
    },
    "status.storage": {
      "glyph": "HardDrive",
      "label": "Storage"
    },
    "action.archive": {
      "glyph": "Archive",
      "label": "Archive"
    },
    "action.mark-unread": {
      "glyph": "Mail",
      "label": "Mark as unread"
    },
    "action.message": {
      "glyph": "MessageSquare",
      "label": "Send message"
    },
    "action.pin": {
      "glyph": "KeyRound",
      "label": "Profile PIN"
    },
    "action.quality": {
      "glyph": "BadgeCheck",
      "label": "Request higher quality"
    },
    "action.resolve": {
      "glyph": "CircleCheckBig",
      "label": "Resolve"
    },
    "action.sign-out": {
      "glyph": "LogOut",
      "label": "Sign out"
    },
    "action.switch-server": {
      "glyph": "ArrowLeft",
      "label": "Switch server"
    },
    "status.account": {
      "glyph": "CircleUserRound",
      "label": "Account"
    },
    "status.preferences": {
      "glyph": "SlidersHorizontal",
      "label": "Preferences"
    },
    "status.watch-with-friends": {
      "glyph": "Users",
      "label": "Watch With Friends"
    },
    "action.record": {
      "glyph": "CircleDot",
      "label": "Record"
    },
    "action.people": {
      "glyph": "UsersRound",
      "label": "Watch with friends"
    },
    "action.restart": {
      "glyph": "RotateCcw",
      "label": "Play from beginning"
    }
  },
  "messages": {
    "destination.library": {
      "text": "library"
    },
    "destination.details": {
      "text": "details"
    },
    "destination.person": {
      "text": "person"
    },
    "destination.settings": {
      "text": "settings"
    },
    "destination.saved-media": {
      "text": "saved media"
    },
    "destination.watch-with-friends": {
      "text": "Watch With Friends"
    },
    "destination.live-tv": {
      "text": "Live TV"
    },
    "destination.search": {
      "text": "search"
    },
    "destination.libraries": {
      "text": "libraries"
    },
    "destination.home": {
      "text": "home"
    },
    "navigation.home": {
      "text": "Home"
    },
    "navigation.libraries": {
      "text": "Libraries"
    },
    "navigation.live-tv": {
      "text": "Live TV"
    },
    "navigation.search": {
      "text": "Search"
    },
    "navigation.saved": {
      "text": "Saved"
    },
    "navigation.primary-label": {
      "text": "Primary navigation"
    },
    "navigation.skip-content": {
      "text": "Skip to content"
    },
    "navigation.open": {
      "text": "Open navigation"
    },
    "navigation.close": {
      "text": "Close navigation"
    },
    "navigation.expand": {
      "text": "Expand navigation"
    },
    "navigation.collapse": {
      "text": "Collapse navigation"
    },
    "navigation.pinned-libraries": {
      "text": "Pinned libraries"
    },
    "navigation.manage": {
      "text": "Manage"
    },
    "navigation.library-options": {
      "text": "Library options for {title}"
    },
    "navigation.move-up": {
      "text": "Move up"
    },
    "navigation.move-down": {
      "text": "Move down"
    },
    "navigation.unpin": {
      "text": "Unpin from sidebar"
    },
    "navigation.unavailable": {
      "title": "Navigation unavailable",
      "body": "Portico couldn't load this navigation right now. Try again.",
      "icon": "status.server"
    },
    "saved.views": {
      "text": "Saved views"
    },
    "action.dismiss": {
      "text": "Dismiss"
    },
    "action.close": {
      "text": "Close"
    },
    "action.close-analysis-options": {
      "text": "Close analysis options"
    },
    "action.close-media-options": {
      "text": "Close {mode} options"
    },
    "action.more-for": {
      "text": "More actions for {title}"